{
  "status": "CANONICAL",
  "version": "1.0.0",
  "authority": "architecture",
  "change_mode": "VERSIONED_ONLY",
  "entity_types": [
    "Organization",
    "Division",
    "Portfolio",
    "Product",
    "Project",
    "RoleDefinition",
    "SkillDefinition",
    "Capability",
    "AgentDefinition",
    "AgentInstance",
    "Workflow",
    "Factory",
    "WorkOrder",
    "ExecutionRun",
    "Tool",
    "Provider",
    "Integration",
    "Runtime",
    "Policy",
    "Constraint",
    "Evidence",
    "Verification",
    "Artifact",
    "Decision"
  ],
  "compatibility_aliases": {
    "RoleSpec": "RoleDefinition",
    "SkillSpec": "SkillDefinition"
  },
  "operating_classes": [
    "control",
    "knowledge",
    "creation",
    "analysis",
    "evaluation",
    "delivery_operations"
  ],
  "functional_domains": [
    "governance-and-orchestration",
    "knowledge-and-research",
    "product-and-design",
    "engineering-and-platform",
    "data-analytics-and-ai",
    "revenue-and-customer",
    "operations-and-supply-chain",
    "finance-risk-and-legal",
    "people-and-learning",
    "creative-media-and-brand",
    "healthcare-and-public-service",
    "built-environment-science-and-field"
  ],
  "autonomy_tiers": ["A0", "A1", "A2", "A3", "A4"],
  "integration_tiers": ["I0", "I1", "I2", "I3", "I4"],
  "evidence_states": ["UNVERIFIED", "DECLARED", "TESTED", "VERIFIED", "SUPERSEDED", "REVOKED"],
  "relationship_types": [
    "authorizes",
    "belongs_to",
    "contains",
    "executes",
    "governed_by",
    "governs",
    "implements",
    "instantiates",
    "owns",
    "produces",
    "provides",
    "requires",
    "supplied_by",
    "supports",
    "uses",
    "validates"
  ]
}
